{
  "batch_protocol_version": "1",
  "batch_id": "b1000000-0000-4000-8000-000000000001",
  "status": "partial",
  "scan_count": 3,
  "completed_count": 1,
  "partial_count": 1,
  "failed_count": 1,
  "cancelled_count": 0,
  "scans": [
    {
      "scan_id": "c1000000-0000-4000-8000-000000000011",
      "status": "complete",
      "result": {
        "schema_version": "1",
        "status": "complete",
        "scan_id": "c1000000-0000-4000-8000-000000000011",
        "target": {
          "raw": "https://alpha.example.com",
          "url": "https://alpha.example.com/",
          "scheme": "https",
          "host": "alpha.example.com",
          "domain": "alpha.example.com",
          "port": 443
        },
        "snapshot": {
          "schema_version": "1",
          "fingerprint": "1a2b3c4d5e6f7a8b9c0d1e2f3a4b5c6d7e8f9a0b1c2d3e4f5a6b7c8d9e0f1a2b",
          "target": {
            "raw": "https://alpha.example.com",
            "url": "https://alpha.example.com/",
            "scheme": "https",
            "host": "alpha.example.com",
            "domain": "alpha.example.com",
            "port": 443
          },
          "captured_at": "2025-03-01T12:00:00Z",
          "assets": [
            {
              "id": "5edad620e1a0fc641b02fbf8931d9a8436e7b56b161c8632100c280fc060c452",
              "kind": "hostname",
              "value": "alpha.example.com"
            }
          ],
          "observations": [
            {
              "id": "7775c36b525c3de528df74bbf618050635dd566dbfa35804f1f7cf472512ce4d",
              "kind": "dns_record",
              "scope": "dns",
              "subject": "alpha.example.com",
              "data": {
                "record_type": "A",
                "value": "192.0.2.10"
              }
            },
            {
              "id": "c3751261831605b52147b91096215391166177117a79d8f434846439931341c2",
              "kind": "tls_certificate",
              "scope": "tls",
              "subject": "alpha.example.com",
              "data": {
                "days_until_expire": 54,
                "fingerprint_sha256": "abcdef123456",
                "verification_status": "valid"
              }
            }
          ],
          "findings": [
            {
              "id": "3f018ba1326a8976a9a7ddc67178a81311ceacbd7c7b5f5ee4de75ba3e6d781d",
              "check_id": "http.root",
              "rule_id": "http.missing_hsts",
              "severity": "low",
              "confidence": "high",
              "title": "Missing Strict-Transport-Security Header",
              "description": "HTTPS website lacks HSTS header.",
              "asset": "https://alpha.example.com/",
              "remediation": "Add HSTS header.",
              "evidence": {}
            }
          ],
          "summary": {
            "total_assets": 1,
            "total_observations": 2,
            "total_findings": 1,
            "critical_findings": 0,
            "high_findings": 0,
            "medium_findings": 0,
            "low_findings": 1,
            "info_findings": 0
          }
        },
        "changes": [],
        "summary": {
          "assets_discovered": 1,
          "total_observations": 2,
          "total_findings": 1,
          "total_changes": 0,
          "total_duration": 500000000
        },
        "started_at": "2026-10-07T00:00:00Z",
        "completed_at": "2026-10-07T00:00:00.510Z",
        "errors": []
      }
    },
    {
      "scan_id": "c1000000-0000-4000-8000-000000000012",
      "status": "failed",
      "error": "synthetic failure"
    },
    {
      "scan_id": "c1000000-0000-4000-8000-000000000013",
      "status": "partial",
      "result": {
        "schema_version": "1",
        "status": "partial",
        "scan_id": "c1000000-0000-4000-8000-000000000013",
        "target": {
          "raw": "https://gamma.example.com",
          "url": "https://gamma.example.com/",
          "scheme": "https",
          "host": "gamma.example.com",
          "domain": "gamma.example.com",
          "port": 443
        },
        "snapshot": {
          "schema_version": "1",
          "fingerprint": "1a2b3c4d5e6f7a8b9c0d1e2f3a4b5c6d7e8f9a0b1c2d3e4f5a6b7c8d9e0f1a2b",
          "target": {
            "raw": "https://gamma.example.com",
            "url": "https://gamma.example.com/",
            "scheme": "https",
            "host": "gamma.example.com",
            "domain": "gamma.example.com",
            "port": 443
          },
          "captured_at": "2025-03-01T12:00:00Z",
          "assets": [
            {
              "id": "5edad620e1a0fc641b02fbf8931d9a8436e7b56b161c8632100c280fc060c452",
              "kind": "hostname",
              "value": "gamma.example.com"
            }
          ],
          "observations": [
            {
              "id": "7775c36b525c3de528df74bbf618050635dd566dbfa35804f1f7cf472512ce4d",
              "kind": "dns_record",
              "scope": "dns",
              "subject": "gamma.example.com",
              "data": {
                "record_type": "A",
                "value": "192.0.2.10"
              }
            },
            {
              "id": "c3751261831605b52147b91096215391166177117a79d8f434846439931341c2",
              "kind": "tls_certificate",
              "scope": "tls",
              "subject": "gamma.example.com",
              "data": {
                "days_until_expire": 54,
                "fingerprint_sha256": "abcdef123456",
                "verification_status": "valid"
              }
            }
          ],
          "findings": [
            {
              "id": "3f018ba1326a8976a9a7ddc67178a81311ceacbd7c7b5f5ee4de75ba3e6d781d",
              "check_id": "http.root",
              "rule_id": "http.missing_hsts",
              "severity": "low",
              "confidence": "high",
              "title": "Missing Strict-Transport-Security Header",
              "description": "HTTPS website lacks HSTS header.",
              "asset": "https://gamma.example.com/",
              "remediation": "Add HSTS header.",
              "evidence": {}
            }
          ],
          "summary": {
            "total_assets": 1,
            "total_observations": 2,
            "total_findings": 1,
            "critical_findings": 0,
            "high_findings": 0,
            "medium_findings": 0,
            "low_findings": 1,
            "info_findings": 0
          }
        },
        "changes": [],
        "summary": {
          "assets_discovered": 1,
          "total_observations": 2,
          "total_findings": 1,
          "total_changes": 0,
          "total_duration": 500000000
        },
        "started_at": "2026-10-07T00:00:00Z",
        "completed_at": "2026-10-07T00:00:00.510Z",
        "errors": [
          "synthetic scan warning"
        ]
      }
    }
  ],
  "summary": {
    "total": 3,
    "completed": 1,
    "partial": 1,
    "failed": 1,
    "cancelled": 0,
    "started_at": "2026-10-07T00:00:00Z",
    "finished_at": "2026-10-07T00:00:02Z",
    "duration": 2000000000,
    "assets": 2,
    "observations": 4,
    "findings": 2,
    "changes": 0,
    "engine_version": "0.1.0-rc1",
    "git_commit": "fixture"
  }
}
